{
  "report_metadata": {
    "report_id": "report-10000000-0000-0000-0000-000000000001",
    "report_type": "anomaly_report",
    "schema_version": "1.0",
    "generated_at": "2026-07-09T00:00:00Z",
    "language": "ko",
    "source_card_id": "10000000-0000-0000-0000-000000000001",
    "agent_run_id": null
  },
  "target_asset": {
    "substation_id": 31,
    "asset_label": "31번 열수급 지점",
    "configuration_type": "SH + DHW",
    "manufacturer_id": "manufacturer 1",
    "window_start": "2020-01-11T00:00:00Z",
    "window_end": "2020-01-11T06:00:00Z",
    "location_label": null
  },
  "priority_summary": {
    "priority_level": "Urgent",
    "priority_score": 89.73,
    "operator_review": "Required",
    "confidence": "high",
    "urgency": "immediate",
    "priority_reason": "공식 위험도 점수가 89.73으로 높고, 위험도 결과도 긴급으로 산정되어 운영자 확인이 필요합니다. 보조 의심 유형은 보통 수준이지만, 주 결과와의 차이가 있어 현장 단정 대신 점검으로 연결해야 합니다. 검토 사유에 현재만 높게 나온 점과 1~3일 리드타임, 수손실 의심 유형이 함께 있어 우선적으로 1차측 환수와 유량 거동을 확인하는 편이 타당합니다."
  },
  "situation_summary": {
    "headline": "31번 열수급 지점에서 1차측 환수와 유량 거동 이상 징후가 긴급 수준으로 탐지됨",
    "summary": "31번 열수급 지점의 SH와 급탕 구성에서 2020년 1월 11일 00시부터 06시까지의 구간 동안 긴급 수준의 이상 징후가 탐지되었습니다. 분석 구간 말미에 1차측 환수 온도와 유량이 함께 낮은 수준으로 관찰되었고, 공급과 환수의 차이도 축소되는 흐름이 보여 운영 검토가 필요합니다. 외기 온도는 약 4도 안팎으로 겨울철이지만 극단적으로 낮지는 않아, 기상보다 설비 또는 제어 상태를 우선 확인해야 합니다. 다만 센서 전체 원시 개수가 충분히 제시되지 않아 현장 단정은 어렵고, 상관 신호 중심의 판단이라는 점을 함께 봐야 합니다. 이 보고서는 고장 확정보다 운영 검토를 위한 사전 탐지 결과로 해석하는 것이 맞습니다.",
    "current_status": "현재까지는 1차측 공급 온도는 유지되지만 환수 온도와 유량 거동이 기대와 다르게 나타난 정황만 확인되었습니다. 누수나 수손실 여부, 밸브 개도, 순환 상태, 계측기 이상 여부는 아직 현장 확인되지 않았습니다. 가장 먼저 1차측 환수와 유량의 실측 추세, 급탕과 난방의 분리 거동, 그리고 제어 명령과 실제 동작의 일치 여부를 확인해야 합니다. 현장 점검 전에는 원인을 확정하지 말고, 운영 로그와 계측 상태를 함께 대조해야 합니다.",
    "impact_summary": "이 징후가 실제 설비 이상으로 이어진다면 열공급 안정성이 흔들리거나 일부 구간의 사용자 체감 온도와 급탕 품질이 영향을 받을 수 있습니다. 환수 저하나 유량 불안정이 지속되면 에너지 효율 저하와 운영 모니터링 부담이 함께 커질 수 있습니다. 단기간에는 즉시 정지보다는 추적 관찰이 가능하더라도, 확대되면 교대 내 대응이 필요한 수준으로 번질 수 있습니다."
  },
  "key_evidence": [
    {
      "label": "위험도 점수",
      "value": 89.73,
      "unit": "점",
      "interpretation": "공식 위험도 점수가 높아 운영자 확인이 필요한 수준입니다. 수치상으로는 즉시 점검 대상을 우선 배정하는 편이 타당합니다.",
      "confidence": "high",
      "evidence_ref_ids": [
        "ref_priority_card_1"
      ]
    },
    {
      "label": "위험도 등급",
      "value": "긴급",
      "unit": null,
      "interpretation": "보고서상 우선순위는 긴급으로 산정되어 즉시 검토 흐름에 넣는 것이 맞습니다. 단, 현장 고장 확정으로 해석해서는 안 됩니다.",
      "confidence": "high",
      "evidence_ref_ids": [
        "ref_priority_card_1"
      ]
    },
    {
      "label": "1차측 환수 온도",
      "value": "34.77",
      "unit": "degC",
      "interpretation": "분석 구간 말미의 1차측 환수 온도가 낮아 보이며, 열수요 처리 또는 순환 상태 변화를 의심할 수 있습니다. 다른 시점과 함께 비교해 급격한 변화인지 확인이 필요합니다.",
      "confidence": "high",
      "evidence_ref_ids": [
        "ref_ops_1",
        "ref_ops_3"
      ]
    },
    {
      "label": "1차측 유량",
      "value": "1.00",
      "unit": "l/h",
      "interpretation": "구간 말미 유량이 매우 낮게 관찰되어 순환 저하, 밸브 상태 변화, 계측 이상 가능성을 함께 봐야 합니다. 단일 시점 값만으로는 원인을 단정할 수 없습니다.",
      "confidence": "high",
      "evidence_ref_ids": [
        "ref_ops_1",
        "ref_ops_3"
      ]
    },
    {
      "label": "공급과 환수의 차이",
      "value": "56.00",
      "unit": "degC",
      "interpretation": "공급과 환수의 차이가 유지되지만 최근 변화폭은 축소되는 흐름입니다. 열교환 성능 변화나 제어 상태 변동을 점검할 근거로 볼 수 있습니다.",
      "confidence": "medium",
      "evidence_ref_ids": [
        "ref_ops_1",
        "ref_ops_3"
      ]
    },
    {
      "label": "외기 부하 맥락",
      "value": "4.47",
      "unit": "degC",
      "interpretation": "겨울철이지만 외기가 매우 낮지는 않아 부하가 급증한 상황으로 보기는 어렵습니다. 기상은 원인보다는 운영 맥락으로 해석하는 것이 적절합니다.",
      "confidence": "medium",
      "evidence_ref_ids": [
        "ref_ops_2"
      ]
    }
  ],
  "risk_analysis": {
    "risk_level": "Urgent",
    "risk_summary": "가장 우려되는 경로는 1차측 순환 저하나 제어 불일치가 지속되면서 환수 거동이 비정상적으로 바뀌는 경우입니다. 유량이 낮아진 상태가 실제 운영 상태라면 열공급 분배와 열교환 효율에 영향을 줄 수 있습니다. 다만 현재는 계측 이상, 밸브 상태 변화, 부하 변동이 섞여 보일 수 있어 현장 확인 전 단정은 금물입니다. 보조 의심 유형이 보통 수준으로 내려가 있어, 주 신호는 강하지만 추가 검증이 필요한 상태로 보는 것이 안전합니다.",
    "operational_impact": "실제 이상이라면 난방과 급탕의 공급 안정성이 떨어져 일부 구간에서 체감 온도 저하나 급탕 품질 흔들림이 생길 수 있습니다. 유량과 환수 온도가 함께 흔들리면 에너지 효율이 떨어지고, 운영자는 원인 분리를 위해 더 많은 추적 관찰을 수행해야 합니다. 즉시 정지보다는 먼저 제어 동작과 계측 신뢰도를 확인하는 쪽이 합리적이지만, 이상이 확대되면 다음 교대까지 미루기 어려울 수 있습니다. 따라서 당일 확인과 후속 추적을 병행해야 하는 성격입니다.",
    "monitoring_points": [
      "1차측 환수 온도가 재상승하는지 또는 계속 낮게 유지되는지 확인",
      "1차측 유량이 0에 가까운 상태로 반복되는지 확인",
      "공급 온도와 환수 온도의 차이가 짧은 시간에 급변하는지 확인",
      "급탕과 난방 부하가 동시에 흔들리는지 확인",
      "밸브 개도와 제어 명령이 실제 유량 변화와 맞는지 확인",
      "계측기 값이 단일 센서만 튀는지 교차 확인"
    ]
  },
  "suspected_causes": [
    {
      "cause": "1차측 순환 저하 또는 유량 제어 불안정",
      "likelihood": "high",
      "rationale": "유량이 매우 낮게 나타나고 환수 온도도 함께 낮아져 순환 흐름이 약해졌을 가능성이 있습니다. 실제로 맞는지 확인하려면 펌프 상태, 밸브 개도, 차압과 유량 추세를 함께 봐야 합니다. 반대로 차압과 유량이 정상인데 센서만 낮다면 이 후보는 약해집니다.",
      "evidence_ref_ids": [
        "ref_ops_1",
        "ref_ops_3"
      ]
    },
    {
      "cause": "계측기 이상 또는 순간값 왜곡",
      "likelihood": "medium",
      "rationale": "단일 시점에서 유량이 극단적으로 낮고 다른 신호와 완전히 같은 방향으로 움직이지 않을 경우 계측 이상도 가능합니다. 같은 구간의 다른 센서와 비교해 불일치가 크면 이 후보가 유력해집니다. 반대로 반복 측정에서도 같은 거동이 재현되면 배제 쪽으로 기웁니다.",
      "evidence_ref_ids": [
        "ref_ops_1"
      ]
    },
    {
      "cause": "급탕과 난방 부하의 비대칭 변동",
      "likelihood": "medium",
      "rationale": "구성상 난방과 급탕이 함께 있는 지점이어서 한쪽 부하 변화가 환수와 유량에 먼저 반영될 수 있습니다. 부하 이력과 제어 명령을 확인했을 때 특정 시간대 수요 변화가 뚜렷하면 이 후보가 강화됩니다. 부하가 안정적인데도 같은 이상이 이어지면 이 후보는 약해집니다.",
      "evidence_ref_ids": [
        "ref_ops_1",
        "ref_ops_2"
      ]
    }
  ],
  "recommended_actions": [
    {
      "action": "1차측 환수 온도와 유량의 최근 추세를 운영 화면에서 다시 확인하고, 30분 간격으로 변화가 이어지는지 점검하세요.",
      "urgency": "immediate",
      "owner_hint": "중앙운영실",
      "expected_outcome": "이상 값이 일시적인지 지속적인지 확인되어 즉시 대응 여부를 판단할 수 있습니다."
    },
    {
      "action": "순환 펌프 상태와 관련 밸브 개도를 확인해 제어 명령과 실제 동작이 맞는지 대조하세요.",
      "urgency": "immediate",
      "owner_hint": "당직 운영자",
      "expected_outcome": "제어 불일치가 있는지 확인되어 운영 조정 또는 설비 점검으로 분기할 수 있습니다."
    },
    {
      "action": "공급과 환수의 차이 변화, 차압, 급탕과 난방 부하 변화를 같은 시간축으로 맞춰 비교하세요.",
      "urgency": "today",
      "owner_hint": "운영 분석 담당",
      "expected_outcome": "부하 변동과 설비 이상을 구분할 수 있는 운영 맥락이 확보됩니다."
    },
    {
      "action": "동일 지점의 다른 계측값과 교차 확인해 유량 또는 환수 온도 센서의 단독 이상 여부를 살펴보세요.",
      "urgency": "today",
      "owner_hint": "계측 점검 담당",
      "expected_outcome": "센서 단독 이상인지 실제 운영 이상인지에 대한 1차 판별이 가능합니다."
    },
    {
      "action": "필요 시 현장 순시를 통해 밸브 위치, 펌프 운전음, 누설 흔적, 계기 표시 상태를 육안으로 확인하세요.",
      "urgency": "next_shift",
      "owner_hint": "현장 순시 인력",
      "expected_outcome": "현장 확인이 필요한지, 다음 교대에 넘겨도 되는지 판단할 수 있습니다."
    },
    {
      "action": "다음 교대에 전달할 수 있도록 현재 추세, 확인 완료 항목, 미확인 항목을 간단히 정리해 인수인계하세요.",
      "urgency": "monitor",
      "owner_hint": "교대 인수인계",
      "expected_outcome": "추적 중인 신호가 끊기지 않고 후속 점검이 이어집니다."
    }
  ],
  "work_order_summary": {
    "work_order_issued": false,
    "status": "not_created",
    "work_order_id": null,
    "summary": "작업지시서는 아직 발행되지 않았습니다. 현재는 긴급 수준의 운영 검토 단계이므로, 즉시 원격 확인과 교대 내 추적 관찰을 먼저 진행하고 현장 점검 필요성이 확인되면 작업지시서를 검토하는 편이 적절합니다.",
    "evidence_refs": [
      "ref_priority_card_1",
      "ref_ops_1",
      "ref_ops_3"
    ]
  },
  "evidence_references": [
    {
      "ref_id": "ref_priority_card_1",
      "source_type": "priority_card",
      "title": "위험도 산정 결과 요약",
      "source_id": "10000000-0000-0000-0000-000000000001",
      "uri": null,
      "excerpt": "공식 위험도 점수 89.73, 위험도 긴급, 운영자 검토 필요로 산정됨.",
      "created_at": null
    },
    {
      "ref_id": "ref_ops_1",
      "source_type": "ops_evidence",
      "title": "분석 구간의 주요 센서 요약",
      "source_id": "00000000-0000-0000-0000-000000000001",
      "uri": null,
      "excerpt": "1차측 환수 온도, 유량, 공급 온도, 공급과 환수 온도 차이의 운영 신호가 함께 제시됨.",
      "created_at": null
    },
    {
      "ref_id": "ref_ops_2",
      "source_type": "external_context",
      "title": "외기 온도와 부하 맥락",
      "source_id": null,
      "uri": null,
      "excerpt": "외기 온도는 약 4도 수준으로, 기상은 원인보다 부하 맥락으로 해석하는 것이 적절함.",
      "created_at": null
    },
    {
      "ref_id": "ref_ops_3",
      "source_type": "ops_evidence",
      "title": "보조 의심 유형에 사용된 변화량 특징",
      "source_id": "보조 의심 유형_handoff/scores/보조 의심 유형_compact13_features.csv",
      "uri": null,
      "excerpt": "환수 온도, 유량 변동성, 공급 온도 오차 변화가 함께 관찰됨.",
      "created_at": null
    },
    {
      "ref_id": "ref_model_1",
      "source_type": "model_output",
      "title": "위험도 결론과 검토 권고",
      "source_id": "20000000-0000-0000-0000-000000000001",
      "uri": null,
      "excerpt": "긴급 수준의 검토 후보이며, 1차측 환수와 유량 거동을 우선 확인하도록 권고됨.",
      "created_at": null
    }
  ],
  "operator_note": {
    "note": "이번 건은 긴급 수준이지만, 현장 고장으로 단정할 단계는 아닙니다. 우선 1차측 환수와 유량, 그리고 제어 명령과 실제 동작의 일치 여부를 확인해야 합니다. 다음 교대에는 지속 여부와 현장 확인 필요성이 분명해지도록 추세와 조치 내용을 함께 넘겨주세요.",
    "review_required": true,
    "review_reasons": [
      "현재만 높게 나온 정황이 있어 지속성 확인이 필요합니다.",
      "1~3일 내 리드타임이 있어 당일 확인과 후속 추적을 함께 해야 합니다.",
      "수손실 의심 유형이 있으나 현장 확인 전에는 확정할 수 없습니다."
    ]
  },
  "rendering_hints": {
    "display_title": "31번 열수급 지점 이상 징후 보고서",
    "severity_badge": {
      "label": "긴급",
      "level": "Urgent",
      "color_hint": "red"
    },
    "section_order": [
      "report_metadata",
      "target_asset",
      "priority_summary",
      "situation_summary",
      "key_evidence",
      "risk_analysis",
      "suspected_causes",
      "recommended_actions",
      "work_order_summary",
      "evidence_references",
      "operator_note",
      "rendering_hints"
    ],
    "page_break_before": [
      "risk_analysis",
      "evidence_references"
    ]
  }
}
